id,order,expected_json
357,"I'll have a SHORT chai latte include Peppermint Syrup include sugar free vanilla include oat milk. remove that oat milk... Coconut Milk, paired with single short DRIP COFFEE add light ice. Next, I need pair of Venti espressos add caramel syrup add oat milk plus ALMOND MILK... scratch that one ALMOND MILK wait PEPPERMINT SYRUP. Next, I need couple of bacon gouda sandwich.","{""items"": [{""name"": ""Chai Latte"", ""size"": ""Short"", ""quantity"": 1, ""modifiers"": [""Peppermint Syrup"", ""Sugar Free Vanilla"", ""Coconut Milk""]}, {""name"": ""Drip Coffee"", ""size"": ""Short"", ""quantity"": 1, ""modifiers"": [""Light Ice""]}, {""name"": ""Espresso"", ""size"": ""Venti"", ""quantity"": 2, ""modifiers"": [""Caramel Syrup"", ""Oat Milk"", ""Peppermint Syrup""]}, {""name"": ""Bacon Gouda Sandwich"", ""size"": null, ""quantity"": 2, ""modifiers"": []}], ""total_price"": 30.55}"
358,"Could you get me triple bacon gouda sandwichs. Next, I need five VENTI flat whites.","{""items"": [{""name"": ""Bacon Gouda Sandwich"", ""size"": null, ""quantity"": 3, ""modifiers"": []}, {""name"": ""Flat White"", ""size"": ""Venti"", ""quantity"": 5, ""modifiers"": []}], ""total_price"": 45.25}"
359,"Grab me a few venti hot chocolate plus LIGHT ICE wait scratch that actually one LIGHT ICE - coconut milk. Next, I need two venti cappuccino.","{""items"": [{""name"": ""Hot Chocolate"", ""size"": ""Venti"", ""quantity"": 3, ""modifiers"": [""Coconut Milk""]}, {""name"": ""Cappuccino"", ""size"": ""Venti"", ""quantity"": 2, ""modifiers"": []}], ""total_price"": 28.1}"
360,"Grab me double trenta cold brew but make you know, sure no whip plus single trenta frappe (mocha) include oat milk, plus two trenta americanos.","{""items"": [{""name"": ""Cold Brew"", ""size"": ""Trenta"", ""quantity"": 2, ""modifiers"": [""No Whip""]}, {""name"": ""Frappe (Mocha)"", ""size"": ""Trenta"", ""quantity"": 1, ""modifiers"": [""Oat Milk""]}, {""name"": ""Americano"", ""size"": ""Trenta"", ""quantity"": 2, ""modifiers"": []}], ""total_price"": 29.55}"
361,"Start me off with double Bagel... bump that to five. Next, I need five Tall CARAMEL MACCHIATOs with Classic Syrup wait remove that Classic Syrup wait breve with light ice. Oh, and add pair of TRENTA frappe (coffee)s plus classic syrup and double like BLUEBERRY MUFFIN.","{""items"": [{""name"": ""Bagel"", ""size"": null, ""quantity"": 5, ""modifiers"": []}, {""name"": ""Caramel Macchiato"", ""size"": ""Tall"", ""quantity"": 5, ""modifiers"": [""Breve"", ""Light Ice""]}, {""name"": ""Frappe (Coffee)"", ""size"": ""Trenta"", ""quantity"": 2, ""modifiers"": [""Classic Syrup""]}, {""name"": ""Blueberry Muffin"", ""size"": null, ""quantity"": 2, ""modifiers"": []}], ""total_price"": 64.25}"
362,"Grab me couple of grande cappuccino plus soy milk add Skim Milk... bump that to triple, coupled with two grande cappuccino. Then give me double grande caramel macchiatos.","{""items"": [{""name"": ""Cappuccino"", ""size"": ""Grande"", ""quantity"": 3, ""modifiers"": [""Soy Milk"", ""Skim Milk""]}, {""name"": ""Cappuccino"", ""size"": ""Grande"", ""quantity"": 2, ""modifiers"": []}, {""name"": ""Caramel Macchiato"", ""size"": ""Grande"", ""quantity"": 2, ""modifiers"": []}], ""total_price"": 38.3}"
363,"I'd like to order triple bagel. Also two Tall DRIP COFFEE add peppermint like syrup but no whip and five Trenta Green Teas. bump that to three, coupled with one venti frappe (mocha) with skim milk. actually nevermind skim milk. Cold Foam with Caramel Drizzle.","{""items"": [{""name"": ""Bagel"", ""size"": null, ""quantity"": 3, ""modifiers"": []}, {""name"": ""Drip Coffee"", ""size"": ""Tall"", ""quantity"": 2, ""modifiers"": [""Peppermint Syrup"", ""No Whip""]}, {""name"": ""Green Tea"", ""size"": ""Trenta"", ""quantity"": 3, ""modifiers"": []}, {""name"": ""Frappe (Mocha)"", ""size"": ""Venti"", ""quantity"": 1, ""modifiers"": [""Cold Foam"", ""Caramel Drizzle""]}], ""total_price"": 35.5}"
364,"Can I get a few TRENTA Earl Grey Teas and caramel drizzle, and also a trenta americano.","{""items"": [{""name"": ""Earl Grey Tea"", ""size"": ""Trenta"", ""quantity"": 3, ""modifiers"": [""Caramel Drizzle""]}, {""name"": ""Americano"", ""size"": ""Trenta"", ""quantity"": 1, ""modifiers"": []}], ""total_price"": 20.0}"
365,Grab me three trenta cappuccino and three trenta iced coffees include caramel syrup.,"{""items"": [{""name"": ""Cappuccino"", ""size"": ""Trenta"", ""quantity"": 3, ""modifiers"": []}, {""name"": ""Iced Coffee"", ""size"": ""Trenta"", ""quantity"": 3, ""modifiers"": [""Caramel Syrup""]}], ""total_price"": 33.0}"
366,"Could I have a few VENTI iced coffee. Next, I need single tall frappe actually (coffee) include Almond Milk and pair of venti drip coffee.","{""items"": [{""name"": ""Iced Coffee"", ""size"": ""Venti"", ""quantity"": 3, ""modifiers"": []}, {""name"": ""Frappe (Coffee)"", ""size"": ""Tall"", ""quantity"": 1, ""modifiers"": [""Almond Milk""]}, {""name"": ""Drip Coffee"", ""size"": ""Venti"", ""quantity"": 2, ""modifiers"": []}], ""total_price"": 25.1}"
367,"I'll have a Venti chai latte with extra shot... wait cancel that, plus couple of tall Latte and soy milk - scratch that one soy milk - classic syrup plus Peppermint Syrup. Oh, and add double venti EARL GREY TEAs include caramel drizzle.","{""items"": [{""name"": ""Latte"", ""size"": ""Tall"", ""quantity"": 2, ""modifiers"": [""Classic Syrup"", ""Peppermint Syrup""]}, {""name"": ""Earl Grey Tea"", ""size"": ""Venti"", ""quantity"": 2, ""modifiers"": [""Caramel Drizzle""]}], ""total_price"": 19.0}"
368,I'll have three trenta Flat Whites.,"{""items"": [{""name"": ""Flat White"", ""size"": ""Trenta"", ""quantity"": 3, ""modifiers"": []}], ""total_price"": 18.75}"
369,"Hit me with a Trenta Mocha but no whip plus light ice wait scratch that one light ice... sugar free vanilla add hazelnut syrup, actually nevermind hazelnut syrup, classic syrup - no, um make it triple, plus four Grande earl grey um tea with Almond Milk plus coconut milk plus breve.","{""items"": [{""name"": ""Mocha"", ""size"": ""Trenta"", ""quantity"": 3, ""modifiers"": [""No Whip"", ""Sugar Free Vanilla"", ""Classic Syrup""]}, {""name"": ""Earl Grey Tea"", ""size"": ""Grande"", ""quantity"": 4, ""modifiers"": [""Almond Milk"", ""Coconut Milk"", ""Breve""]}], ""total_price"": 43.4}"
370,Gimme four TRENTA espressos include Almond Milk.,"{""items"": [{""name"": ""Espresso"", ""size"": ""Trenta"", ""quantity"": 4, ""modifiers"": [""Almond Milk""]}], ""total_price"": 20.4}"
371,"I'd like to order one trenta mocha with Coconut Milk include extra shot, coupled with three venti uh Hot Chocolates and skim milk but ensure No Whip.","{""items"": [{""name"": ""Mocha"", ""size"": ""Trenta"", ""quantity"": 1, ""modifiers"": [""Coconut Milk"", ""Extra Shot""]}, {""name"": ""Hot Chocolate"", ""size"": ""Venti"", ""quantity"": 3, ""modifiers"": [""Skim Milk"", ""No Whip""]}], ""total_price"": 23.2}"
372,"I'll take a tall Latte add Coconut Milk, and also one Grande drip coffee with hazelnut syrup.","{""items"": [{""name"": ""Latte"", ""size"": ""Tall"", ""quantity"": 1, ""modifiers"": [""Coconut Milk""]}, {""name"": ""Drip Coffee"", ""size"": ""Grande"", ""quantity"": 1, ""modifiers"": [""Hazelnut Syrup""]}], ""total_price"": 8.7}"
373,"Gimme a grande hot chocolate plus caramel drizzle include actually soy milk, plus triple grande CAPPUCCINO plus whip cream, actually make that pair of. Next, I need two bacon gouda sandwich. Next, I need two bagels.","{""items"": [{""name"": ""Hot Chocolate"", ""size"": ""Grande"", ""quantity"": 1, ""modifiers"": [""Caramel Drizzle"", ""Soy Milk""]}, {""name"": ""Cappuccino"", ""size"": ""Grande"", ""quantity"": 2, ""modifiers"": [""Whip Cream""]}, {""name"": ""Bacon Gouda Sandwich"", ""size"": null, ""quantity"": 2, ""modifiers"": []}, {""name"": ""Bagel"", ""size"": null, ""quantity"": 2, ""modifiers"": []}], ""total_price"": 32.6}"
374,"Start me off with one trenta caramel macchiato, plus three grande Chai Latte include Extra Shot with skim milk. actually nevermind skim milk wait whip cream and hold the ice, actually make that one.","{""items"": [{""name"": ""Caramel Macchiato"", ""size"": ""Trenta"", ""quantity"": 1, ""modifiers"": []}, {""name"": ""Chai Latte"", ""size"": ""Grande"", ""quantity"": 1, ""modifiers"": [""Extra Shot"", ""Whip Cream"", ""No Ice""]}], ""total_price"": 13.5}"
375,"May I get triple Bacon Gouda Sandwichs. Also single Trenta latte with EXTRA HOT with Extra Shot and oat milk. actually nevermind oat milk... classic syrup. Next, I need triple venti chai literally latte add SKIM MILK - remove that.","{""items"": [{""name"": ""Bacon Gouda Sandwich"", ""size"": null, ""quantity"": 3, ""modifiers"": []}, {""name"": ""Latte"", ""size"": ""Trenta"", ""quantity"": 1, ""modifiers"": [""Extra Hot"", ""Extra Shot"", ""Classic Syrup""]}], ""total_price"": 23.5}"
376,I'll take a venti Flat White.,"{""items"": [{""name"": ""Flat White"", ""size"": ""Venti"", ""quantity"": 1, ""modifiers"": []}], ""total_price"": 5.75}"
377,"Hook me up with five tall strawberry smoothie and oat milk... bump that to triple. Also a few grande like cappuccinos add almond milk plus soy milk. Also a tall uh flat white, plus double short Cold Brews wait um actually nevermind.","{""items"": [{""name"": ""Strawberry Smoothie"", ""size"": ""Tall"", ""quantity"": 3, ""modifiers"": [""Oat Milk""]}, {""name"": ""Cappuccino"", ""size"": ""Grande"", ""quantity"": 3, ""modifiers"": [""Almond Milk"", ""Soy Milk""]}, {""name"": ""Flat White"", ""size"": ""Tall"", ""quantity"": 1, ""modifiers"": []}], ""total_price"": 43.75}"
378,"Gimme five bacon gouda sandwichs, and also pair of grande frappe (coffee)s, coupled with three grande Cold Brew include skim milk - uh wait cancel that skim milk - Breve.","{""items"": [{""name"": ""Bacon Gouda Sandwich"", ""size"": null, ""quantity"": 5, ""modifiers"": []}, {""name"": ""Frappe (Coffee)"", ""size"": ""Grande"", ""quantity"": 2, ""modifiers"": []}, {""name"": ""Cold Brew"", ""size"": ""Grande"", ""quantity"": 3, ""modifiers"": [""Breve""]}], ""total_price"": 56.15}"
379,"Lemme get a few trenta Frappe (Mocha) add extra hot and oat milk, wait cancel that oat milk - make sure no ice include skim milk, bump that to five plus five venti espressos plus COLD FOAM with CARAMEL DRIZZLE. Next, I need an avocado toast, coupled with a few short STRAWBERRY SMOOTHIE and ALMOND MILK wait remove that.","{""items"": [{""name"": ""Frappe (Mocha)"", ""size"": ""Trenta"", ""quantity"": 5, ""modifiers"": [""Extra Hot"", ""No Ice"", ""Skim Milk""]}, {""name"": ""Espresso"", ""size"": ""Venti"", ""quantity"": 5, ""modifiers"": [""Cold Foam"", ""Caramel Drizzle""]}, {""name"": ""Avocado Toast"", ""size"": null, ""quantity"": 1, ""modifiers"": []}], ""total_price"": 72.0}"
380,Grab me five venti Cappuccino plus SOY MILK.,"{""items"": [{""name"": ""Cappuccino"", ""size"": ""Venti"", ""quantity"": 5, ""modifiers"": [""Soy Milk""]}], ""total_price"": 30.5}"
381,"Could you get me single bagel, bump that to couple of. Next, I need double actually grande americanos. Also a bacon gouda sandwich plus three tall green tea include almond milk include light ice wait wait cancel that light ice, Breve.","{""items"": [{""name"": ""Bagel"", ""size"": null, ""quantity"": 2, ""modifiers"": []}, {""name"": ""Americano"", ""size"": ""Grande"", ""quantity"": 2, ""modifiers"": []}, {""name"": ""Bacon Gouda Sandwich"", ""size"": null, ""quantity"": 1, ""modifiers"": []}, {""name"": ""Green Tea"", ""size"": ""Tall"", ""quantity"": 3, ""modifiers"": [""Almond Milk"", ""Breve""]}], ""total_price"": 31.7}"
382,"Grab me one blueberry uh muffin, coupled with double BAGELs, and also double TALL literally HOT CHOCOLATE. Also two literally trenta matcha latte plus LIGHT ICE.","{""items"": [{""name"": ""Blueberry Muffin"", ""size"": null, ""quantity"": 1, ""modifiers"": []}, {""name"": ""Bagel"", ""size"": null, ""quantity"": 2, ""modifiers"": []}, {""name"": ""Hot Chocolate"", ""size"": ""Tall"", ""quantity"": 2, ""modifiers"": []}, {""name"": ""Matcha Latte"", ""size"": ""Trenta"", ""quantity"": 2, ""modifiers"": [""Light Ice""]}], ""total_price"": 30.25}"
383,"Could you get me three grande frappe (mocha) - bump that to pair of, coupled with pair of like Grande frappe (mocha).","{""items"": [{""name"": ""Frappe (Mocha)"", ""size"": ""Grande"", ""quantity"": 4, ""modifiers"": []}], ""total_price"": 25.0}"
384,"Hook me up with couple of venti hot chocolates but ensure no ice add coconut milk add PEPPERMINT SYRUP, plus triple trenta Hot Chocolate you know, include Oat Milk plus couple of Trenta hot chocolate add caramel drizzle.","{""items"": [{""name"": ""Hot Chocolate"", ""size"": ""Venti"", ""quantity"": 2, ""modifiers"": [""No Ice"", ""Coconut Milk"", ""Peppermint Syrup""]}, {""name"": ""Hot Chocolate"", ""size"": ""Trenta"", ""quantity"": 3, ""modifiers"": [""Oat Milk""]}, {""name"": ""Hot Chocolate"", ""size"": ""Trenta"", ""quantity"": 2, ""modifiers"": [""Caramel Drizzle""]}], ""total_price"": 43.3}"
385,"Hit me with triple BLUEBERRY MUFFIN, and also four um avocado toasts plus five Venti Strawberry Smoothie and caramel syrup include classic syrup, paired with two venti GREEN TEAs.","{""items"": [{""name"": ""Blueberry Muffin"", ""size"": null, ""quantity"": 3, ""modifiers"": []}, {""name"": ""Avocado Toast"", ""size"": null, ""quantity"": 4, ""modifiers"": []}, {""name"": ""Strawberry Smoothie"", ""size"": ""Venti"", ""quantity"": 5, ""modifiers"": [""Caramel Syrup"", ""Classic Syrup""]}, {""name"": ""Green Tea"", ""size"": ""Venti"", ""quantity"": 2, ""modifiers"": []}], ""total_price"": 84.75}"
386,I'm feeling like pair of trenta Hot Chocolates.,"{""items"": [{""name"": ""Hot Chocolate"", ""size"": ""Trenta"", ""quantity"": 2, ""modifiers"": []}], ""total_price"": 11.0}"
387,Gimme three blueberry muffins.,"{""items"": [{""name"": ""Blueberry Muffin"", ""size"": null, ""quantity"": 3, ""modifiers"": []}], ""total_price"": 11.25}"
388,Let's do a trenta Caramel Macchiato and three butter croissant. Then give me single short literally green tea.,"{""items"": [{""name"": ""Caramel Macchiato"", ""size"": ""Trenta"", ""quantity"": 1, ""modifiers"": []}, {""name"": ""Butter Croissant"", ""size"": null, ""quantity"": 3, ""modifiers"": []}, {""name"": ""Green Tea"", ""size"": ""Short"", ""quantity"": 1, ""modifiers"": []}], ""total_price"": 19.75}"
389,"Start me off with a BUTTER CROISSANT. wait, change that to triple.","{""items"": [{""name"": ""Butter Croissant"", ""size"": null, ""quantity"": 3, ""modifiers"": []}], ""total_price"": 10.5}"
390,Let's do double tall Cold Brews.,"{""items"": [{""name"": ""Cold Brew"", ""size"": ""Tall"", ""quantity"": 2, ""modifiers"": []}], ""total_price"": 8.5}"
391,Grab me a venti literally caramel macchiato.,"{""items"": [{""name"": ""Caramel Macchiato"", ""size"": ""Venti"", ""quantity"": 1, ""modifiers"": []}], ""total_price"": 6.25}"
392,"Let me get three bacon actually gouda sandwichs. Oh, and add a Trenta Frappe (Mocha) and breve make sure there's ensure no whip add make sure No Ice - remove that make sure No Ice, Caramel Syrup, coupled with a like blueberry muffin.","{""items"": [{""name"": ""Bacon Gouda Sandwich"", ""size"": null, ""quantity"": 3, ""modifiers"": []}, {""name"": ""Frappe (Mocha)"", ""size"": ""Trenta"", ""quantity"": 1, ""modifiers"": [""Breve"", ""No Whip"", ""Caramel Syrup""]}, {""name"": ""Blueberry Muffin"", ""size"": null, ""quantity"": 1, ""modifiers"": []}], ""total_price"": 28.8}"
393,"Could you get me a few tall latte make sure there's skim milk, actually nevermind skim milk. no ice with Caramel Syrup add whip cream, and also triple like Venti Caramel Macchiatos, coupled with three grande you know, green tea.","{""items"": [{""name"": ""Latte"", ""size"": ""Tall"", ""quantity"": 3, ""modifiers"": [""No Ice"", ""Caramel Syrup"", ""Whip Cream""]}, {""name"": ""Caramel Macchiato"", ""size"": ""Venti"", ""quantity"": 3, ""modifiers"": []}, {""name"": ""Green Tea"", ""size"": ""Grande"", ""quantity"": 3, ""modifiers"": []}], ""total_price"": 45.75}"
394,Hit me with pair of like bagel.,"{""items"": [{""name"": ""Bagel"", ""size"": null, ""quantity"": 2, ""modifiers"": []}], ""total_price"": 5.0}"
395,I'm craving five grande strawberry smoothies.,"{""items"": [{""name"": ""Strawberry Smoothie"", ""size"": ""Grande"", ""quantity"": 5, ""modifiers"": []}], ""total_price"": 32.5}"
396,Lemme get pair of trenta actually Frappe (Mocha)s add coconut milk add light ice add coconut milk - wait cancel that coconut milk - vanilla syrup plus two Venti frappe (coffee)s.,"{""items"": [{""name"": ""Frappe (Mocha)"", ""size"": ""Trenta"", ""quantity"": 2, ""modifiers"": [""Coconut Milk"", ""Light Ice"", ""Vanilla Syrup""]}, {""name"": ""Frappe (Coffee)"", ""size"": ""Venti"", ""quantity"": 2, ""modifiers"": []}], ""total_price"": 29.9}"
397,"Could I have a blueberry muffin, coupled with a venti caramel macchiato, no whip and hazelnut syrup... wait cancel that hazelnut syrup actually wait soy milk and triple GRANDE frappe (coffee)s plus triple Tall cold brew add Peppermint Syrup include sugar free vanilla.","{""items"": [{""name"": ""Blueberry Muffin"", ""size"": null, ""quantity"": 1, ""modifiers"": []}, {""name"": ""Caramel Macchiato"", ""size"": ""Venti"", ""quantity"": 1, ""modifiers"": [""No Whip"", ""Soy Milk""]}, {""name"": ""Frappe (Coffee)"", ""size"": ""Grande"", ""quantity"": 3, ""modifiers"": []}, {""name"": ""Cold Brew"", ""size"": ""Tall"", ""quantity"": 3, ""modifiers"": [""Peppermint Syrup"", ""Sugar Free Vanilla""]}], ""total_price"": 44.35}"
398,"Grab me three Butter Croissants. Also double uh Avocado Toasts, plus a few VENTI matcha like latte.","{""items"": [{""name"": ""Butter Croissant"", ""size"": null, ""quantity"": 3, ""modifiers"": []}, {""name"": ""Avocado Toast"", ""size"": null, ""quantity"": 2, ""modifiers"": []}, {""name"": ""Matcha Latte"", ""size"": ""Venti"", ""quantity"": 3, ""modifiers"": []}], ""total_price"": 43.25}"
399,"May I get four avocado toasts, plus triple Trenta americanos.","{""items"": [{""name"": ""Avocado Toast"", ""size"": null, ""quantity"": 4, ""modifiers"": []}, {""name"": ""Americano"", ""size"": ""Trenta"", ""quantity"": 3, ""modifiers"": []}], ""total_price"": 43.0}"
400,"Can I get five grande frappe (coffee) uh add Coconut Milk, paired with two tall strawberry smoothies add cold foam with Caramel Drizzle. Oh, and add double short Mochas and extra shot. actually nevermind extra shot wait um peppermint syrup.","{""items"": [{""name"": ""Frappe (Coffee)"", ""size"": ""Grande"", ""quantity"": 5, ""modifiers"": [""Coconut Milk""]}, {""name"": ""Strawberry Smoothie"", ""size"": ""Tall"", ""quantity"": 2, ""modifiers"": [""Cold Foam"", ""Caramel Drizzle""]}, {""name"": ""Mocha"", ""size"": ""Short"", ""quantity"": 2, ""modifiers"": [""Peppermint Syrup""]}], ""total_price"": 59.0}"
401,"Hook me up with three short Flat Whites. Then give me single trenta matcha latte. Then give me four like short CARAMEL MACCHIATOs include Extra Hot, plus single VENTI earl grey tea and extra shot.","{""items"": [{""name"": ""Flat White"", ""size"": ""Short"", ""quantity"": 3, ""modifiers"": []}, {""name"": ""Matcha Latte"", ""size"": ""Trenta"", ""quantity"": 1, ""modifiers"": []}, {""name"": ""Caramel Macchiato"", ""size"": ""Short"", ""quantity"": 4, ""modifiers"": [""Extra Hot""]}, {""name"": ""Earl Grey Tea"", ""size"": ""Venti"", ""quantity"": 1, ""modifiers"": [""Extra Shot""]}], ""total_price"": 43.5}"
402,"Gimme single Short americano - bump that um to three. Next, I need couple of Grande hot chocolates with almond literally milk and sugar free vanilla, paired with double BAGELs. Then give me double venti uh Frappe (Coffee) plus OAT MILK.","{""items"": [{""name"": ""Americano"", ""size"": ""Short"", ""quantity"": 3, ""modifiers"": []}, {""name"": ""Hot Chocolate"", ""size"": ""Grande"", ""quantity"": 2, ""modifiers"": [""Almond Milk"", ""Sugar Free Vanilla""]}, {""name"": ""Bagel"", ""size"": null, ""quantity"": 2, ""modifiers"": []}, {""name"": ""Frappe (Coffee)"", ""size"": ""Venti"", ""quantity"": 2, ""modifiers"": [""Oat Milk""]}], ""total_price"": 39.8}"
403,"Could I have two venti latte, and also couple of Short cold brew.","{""items"": [{""name"": ""Latte"", ""size"": ""Venti"", ""quantity"": 2, ""modifiers"": []}, {""name"": ""Cold Brew"", ""size"": ""Short"", ""quantity"": 2, ""modifiers"": []}], ""total_price"": 18.5}"
404,"May I get single like trenta chai latte plus sugar free vanilla. Oh, and add single blueberry muffin.","{""items"": [{""name"": ""Chai Latte"", ""size"": ""Trenta"", ""quantity"": 1, ""modifiers"": [""Sugar Free Vanilla""]}, {""name"": ""Blueberry Muffin"", ""size"": null, ""quantity"": 1, ""modifiers"": []}], ""total_price"": 10.5}"
405,Lemme get triple Bagel.,"{""items"": [{""name"": ""Bagel"", ""size"": null, ""quantity"": 3, ""modifiers"": []}], ""total_price"": 7.5}"
406,Lemme get a short earl uh grey tea.,"{""items"": [{""name"": ""Earl Grey Tea"", ""size"": ""Short"", ""quantity"": 1, ""modifiers"": []}], ""total_price"": 2.5}"
407,"Hook me up with four blueberry muffins - wait cancel that, plus two VENTI frappe (mocha), and also one grande drip coffee, hold the ice, plus two venti green teas make sure there's Caramel Drizzle, remove that Caramel Drizzle wait ensure no whip.","{""items"": [{""name"": ""Frappe (Mocha)"", ""size"": ""Venti"", ""quantity"": 2, ""modifiers"": []}, {""name"": ""Drip Coffee"", ""size"": ""Grande"", ""quantity"": 1, ""modifiers"": [""No Ice""]}, {""name"": ""Green Tea"", ""size"": ""Venti"", ""quantity"": 2, ""modifiers"": [""No Whip""]}], ""total_price"": 24.5}"
408,"Let me get a Venti drip actually coffee and extra shot add skim milk, actually nevermind skim milk, Light Ice.","{""items"": [{""name"": ""Drip Coffee"", ""size"": ""Venti"", ""quantity"": 1, ""modifiers"": [""Extra Shot"", ""Light Ice""]}], ""total_price"": 4.5}"
409,"May I get triple tall mochas. Oh, and add five Trenta Chai Lattes actually and no whip.","{""items"": [{""name"": ""Mocha"", ""size"": ""Tall"", ""quantity"": 3, ""modifiers"": []}, {""name"": ""Chai Latte"", ""size"": ""Trenta"", ""quantity"": 5, ""modifiers"": [""No Whip""]}], ""total_price"": 46.25}"
410,"I'd like to order a like SHORT flat white and a venti caramel macchiato add extra shot with cold foam, wait cancel that cold foam, LIGHT ICE, coupled with triple tall americanos, paired with pair you know, of grande chai lattes.","{""items"": [{""name"": ""Flat White"", ""size"": ""Short"", ""quantity"": 1, ""modifiers"": []}, {""name"": ""Caramel Macchiato"", ""size"": ""Venti"", ""quantity"": 1, ""modifiers"": [""Extra Shot"", ""Light Ice""]}, {""name"": ""Americano"", ""size"": ""Tall"", ""quantity"": 3, ""modifiers"": []}, {""name"": ""Chai Latte"", ""size"": ""Grande"", ""quantity"": 2, ""modifiers"": []}], ""total_price"": 32.5}"
411,Grab me pair of like tall Cold Brew.,"{""items"": [{""name"": ""Cold Brew"", ""size"": ""Tall"", ""quantity"": 2, ""modifiers"": []}], ""total_price"": 8.5}"
412,"I'm feeling like two actually tall espressos include soy milk include Breve... wait cancel that, paired with two VENTI Espressos with hazelnut syrup.","{""items"": [{""name"": ""Espresso"", ""size"": ""Venti"", ""quantity"": 2, ""modifiers"": [""Hazelnut Syrup""]}], ""total_price"": 9.0}"
413,"I'd like to order a few you know, butter croissants, coupled with triple venti strawberry smoothies, no whip, plus pair of short Frappe literally (Coffee) plus one Venti iced coffee.","{""items"": [{""name"": ""Butter Croissant"", ""size"": null, ""quantity"": 3, ""modifiers"": []}, {""name"": ""Strawberry Smoothie"", ""size"": ""Venti"", ""quantity"": 3, ""modifiers"": [""No Whip""]}, {""name"": ""Frappe (Coffee)"", ""size"": ""Short"", ""quantity"": 2, ""modifiers"": []}, {""name"": ""Iced Coffee"", ""size"": ""Venti"", ""quantity"": 1, ""modifiers"": []}], ""total_price"": 45.5}"
414,"Lemme get two Trenta Mochas, paired with two SHORT Cold Brew and hold the No Whip - remove that hold the No Whip... Cold Foam plus Caramel Syrup add classic syrup. Next, I need a few avocado toasts, paired with two short Chai actually Lattes.","{""items"": [{""name"": ""Mocha"", ""size"": ""Trenta"", ""quantity"": 2, ""modifiers"": []}, {""name"": ""Cold Brew"", ""size"": ""Short"", ""quantity"": 2, ""modifiers"": [""Cold Foam"", ""Caramel Syrup"", ""Classic Syrup""]}, {""name"": ""Avocado Toast"", ""size"": null, ""quantity"": 3, ""modifiers"": []}, {""name"": ""Chai Latte"", ""size"": ""Short"", ""quantity"": 2, ""modifiers"": []}], ""total_price"": 53.5}"
415,"Let me get double butter croissant, paired with a Venti earl grey tea uh with hazelnut syrup plus skim milk, coupled with a bacon gouda sandwich.","{""items"": [{""name"": ""Butter Croissant"", ""size"": null, ""quantity"": 2, ""modifiers"": []}, {""name"": ""Earl Grey Tea"", ""size"": ""Venti"", ""quantity"": 1, ""modifiers"": [""Hazelnut Syrup"", ""Skim Milk""]}, {""name"": ""Bacon Gouda Sandwich"", ""size"": null, ""quantity"": 1, ""modifiers"": []}], ""total_price"": 17.0}"
416,"Let me get one uh venti mocha, coupled with triple Trenta hot chocolates add extra hot - wait cancel that extra hot - almond milk, coupled with a grande iced coffee and a grande Earl Grey Tea plus Vanilla Syrup with you know, light ice... remove that light ice - oat milk include Whip Cream... scratch that one Whip Cream... SKIM MILK.","{""items"": [{""name"": ""Mocha"", ""size"": ""Venti"", ""quantity"": 1, ""modifiers"": []}, {""name"": ""Hot Chocolate"", ""size"": ""Trenta"", ""quantity"": 3, ""modifiers"": [""Almond Milk""]}, {""name"": ""Iced Coffee"", ""size"": ""Grande"", ""quantity"": 1, ""modifiers"": []}, {""name"": ""Earl Grey Tea"", ""size"": ""Grande"", ""quantity"": 1, ""modifiers"": [""Vanilla Syrup"", ""Oat Milk"", ""Skim Milk""]}], ""total_price"": 32.6}"
